	Sentence	prayer_or_nah
291	And it has something to say to us about how we should pray.	1
292	First, let it hit you that Jesus prayed.	1
293	“In everything by prayer and supplication with thanksgiving [he let his] requests be made known to God” (Philippians 4:6).	1
294	Hebrews 5:7 gives us a glimpse of the glory of Christ’s humility in his incarnation.	1
295	We see some of what it meant for him to empty himself by becoming human and taking the form of a servant (Philippians 2:7).	0
296	In his fully divine nature, Jesus had continual communion with his Father.	1
297	But in his fully human nature, he had to pray to the Father just like we do.	1
298	That’s why “he would withdraw to desolate places and pray” (Luke 5:16), sometimes praying entire nights (Luke 6:12).	1
299	He knew he could do nothing on his own and was completely dependent on the Father (John 5:19).	0
300	If Jesus had to pray, and pray a lot, so do we.	1
301	And he prayed “with loud cries and tears.” Complete dependence on God was not merely an abstract theological concept for Jesus; it was a desperate, experiential reality.	1
302	This verse isn’t referring only to Gethsemane, because Jesus prayed this way “in the days of his flesh.” During Jesus’s human experience on earth, he repeatedly, and likely regularly, prayed with loud cries and tears.	1
303	Why was he moved to pray so passionately?	1
304	He was keenly aware that heaven and hell were real outcomes for real souls as a result of his mission.	0
305	He knew there were demonized persons needing deliverance, sick needing healing, particular gospel truths needing to be proclaimed at particular times in particular places for particular persons.	0
306	He and his disciples were also usually living hand-to-mouth on a daily basis.	0
307	He also had the forces of hell constantly trying to destroy him, his disciples, and his mission.	0
308	We know the spiritual warfare that erupts whenever we attempt real, meaningful kingdom labor.	0
309	Imagine what it was like for Jesus.	0
310	And, of course, the cross was always looming before him, growing larger as the day drew nearer.	0
311	He knew that when he offered himself as a sacrifice, and absorbed the full wrath of God for the sins of all who would believe in him, and died (John 3:16), only the Father “was able to save him from death.”	0
312	Jesus knew the nature of his freely chosen human helplessness made him dependent on the Father for all these things.	0
313	So, he prayed with loud cries and tears out of his desperate human need for his Father’s help.	1
314	We also desperately need the Father’s help in all these things, too, including preparing for our own death, through which we trust him to deliver us.	0
315	Would you have expected the author of Hebrews to say that Jesus “was heard because of his reverence”?	0
316	Wouldn’t we have expected, Jesus was heard because he was God’s Son?	0
317	Jesus had positional access to the Father, and in him so do we.	0
318	But the author didn’t say that.	0
319	He chose “reverence.” Why?	0
320	Reverence is a holy fear of God.	0
321	Now, this is astonishing: God the Son regards God the Father with an appropriate holy fear.	0
322	The Son is not afraid of the Father’s judgment.	0
323	He simply has the appropriate regard of the Father’s omnipotent, omniscient, omnipresent, and eternal greatness.	0
324	Terror is what persons experience when they truly encounter God and yet have no access to him as a Father.	0
325	Reverence is what persons experience when they have free access to the Father as his children — when they know the Father, and believe what the Father says.	0
326	Reverence isn’t a feigned respectful or formal demeanor we put on when we pray to God that looks quite different from the rest of the way we live and talk.	1
327	Persons who truly revere God do so all the time.	0
328	When you hear them pray, it doesn’t sound much different than the way they usually talk.	1
329	You can just tell they believe they are speaking to God himself.	1
330	Their reverence enables them to approach him like the loving Father that he is.	0
331	God’s throne is a throne of grace (Hebrews 4:16).	0
332	So, a reverent child of God feels the freedom to come to him in desperate need, even with loud cries and tears, because God is honored when that child comes to him in desperate faith.	1
333	If we lack reverence for God, it shows up in the way we live and in the way we pray.	1
334	These are indicators that we do not know him like he wants us to, and therefore our faith in him is very small, which is likely why we aren’t realizing more answered prayer.	1
335	If this is true about us, let’s forget trying to guilt ourselves into praying more, except to allow our guilt to drive us to repentance.	0
336	Rather, let’s note how Jesus prayed and pray like him!	1
337	Jesus prayed because he knew the extent of his human need.	1
338	He prayed in reverential faith because he believed God and loved him with all his being.	1
339	And he persisted and prevailed in prayer, sometimes praying with loud cries and tears, because he knew what he was up against, the strongholds imprisoning people, and the cost of his mission.	1
340	He prayed, and he was heard.	1
341	We only pray when, like Jesus, we are aware of our real need.	1
342	The greater this awareness is, the greater our sense of desperation for God’s help.	0
343	And the greater our desperation for God, the more we will pray.	1
344	And the more we will pray, the more we will experience the joy of his presence and his power for mission.	1
345	That’s why God wants us to pray like Jesus.	1
346	He wants us to come to him.	0
347	His great invitation to us is to come and ask, to ask in faith, and to keep asking in faith until we receive his answer.	1
348	Do not lose heart; do not give up; pray, even with loud cries and tears, until God grants the breakthrough you seek.	1
349	Sign up for notifications about new content:	0
350	I was told that the skeletal lesions I have, as well as my bone marrow, appear to be cancer that has spread.	0
351	I was sent immediately for various other tests (mammo, chest x-ray, further MRI's, scope, etc) and thanks to a whole lot of prayer from myself and several kind strangers, God has allowed...	1
352	LEGACY 242 CHURCH  DEPTFORD ,NEW JERSEY                                                                                                  A PRAYER REQUEST FOR OUR CHISTIAN FAMILY MEMBERS ,STEVEN MARFIA AND KIM MARFIA .A COUPLE WHOS MISSION IS TO PLANT CHURCH AND BRING DISCIPLES TO GOD AND JION...	1
353	My wife of 24 years has asked for a divorce.	0
354	Please let the Lord guide us to his will.	0
355	Let us follow his will and not be misguided.	0
356	I humbly come before your throne of grace, Lord I pray and I ask that you please bless me with a way to pay my entire rent in my water bill by Tuesday.	1
357	father God I'm working I'm working two jobs a matter of fact still am having problems getting my rent paid I'm praying ask that you please make a...	1
358	Lord go to ELs heart and if I'm in it, please make,a.way for us, be it the will.,if,not,heal my thoughts and lead me,in a different direction but he calls me Lord, and I have feelings I need you to validate this relationship father God, I am,open to him coming back into my life, lead out way...	0
359	Lord i pray you shpw us favor when we meet my sonAdan therapist.Please lord soften his heart that he may approve us for chaparones.Lord i aslo pray that you reunite him with his daughter Nayiah.Lors I pray you hear mt prayers	1
360	Please bless my marriage that my husband would come home after work.	1
361	That he would enjoy my company like he used to; that other things wouldn't pull him away from the family.	0
362	I am praying for the salvation of my husband.	1
363	He has abandoned me and my children for the devil.	0
364	I am asking that the devil be removed from his life and replaced with God.	1
365	Please In Jesus name, restore our marriage.	1
366	Praise you.	0
367	Hi my mom recently passed away and i was asking for prayer for my mom's doctors to sign a document to release funds to me for her 401k.	1
368	We are using it to purchase her grave stone.	0
369	Please, pray they sign it without a second glance or it be a big hassle, they would remember the Gospel of love, and...	1
370	Please, pray for myself and loved ones to have sustained deliverance from all strongholds, storms/trials cease in our lives, always be in our right minds, absolute gentleness, purity, peace, huge financial blessing, and for my unspoken prayer requests to be answered over us.	1
371	Please, also pray for...	1
