	Sentence
2985	For He's more precious than anything
2986	Jesus, You're my confidence, Jesus, You're my hope
2987	You will keep my feet from stumbling
2988	Jesus, You're my confidence, Jesus, You're my hope
2989	You will keep my feet from stumbling
2990	I'll trust in the Lord with all my heart
2991	And will not lean on my own understanding
2992	In all my ways I'll acknowledge Him
2993	And He'll make straight all my paths
2994	Trust in the Lord
2995	It Is Not Death to Die
2996	It is not death to die
2997	To leave this weary road
2998	And join the saints who dwell on high
2999	Who've found their home with God
3000	It is not death to close
3001	The eyes long dimmed by tears
3002	And wake in joy before Your throne
3003	Delivered from our fears
3004	O Jesus, conquering the grave
3005	Your precious blood has power to save
3006	Those who trust in You
3007	Will in Your mercy find
3008	That it is not death to die
3009	It is not death to fling
3010	Aside this earthly dust
3011	And rise with strong and noble wing
3012	To live among the just
3013	It is not death to hear
3014	The key unlock the door
3015	That sets us free from mortal years
3016	To praise You evermore
3017	O Jesus, conquering the grave
3018	Your precious blood has power to save
3019	Those who trust in You
3020	Will in Your mercy find
3021	That it is not death to die
3022	I Have a Shelter
3023	We do not have the lyrics for I Have a Shelter yet.
3024	Glorious
3025	How great You are
3026	Your greatness none can fathom
3027	Upholding all
3028	By Your almighty Word
3029	The universe
3030	Fulfills Your every purpose
3031	And all You've made
3032	Will bring You praise, O God
3033	You are glorious, glorious
3034	And we will lift our voices to worship You
3035	You are glorious, glorious
3036	And we will always be in awe of You
3037	You move the stars
3038	The planets in their courses
3039	The clouds and wind
3040	And everything that moves
3041	You hold my life
3042	You take my joys and sorrows
3043	And cause them all
3044	To bring glory to You
3045	Your ways are high
3046	Too deep for man to fathom
3047	But You are good
3048	And this will be my theme
3049	You sent Your Son
3050	To live and die for sinners
3051	So I will trust
3052	And hope in You, my King
3053	Joy in My Morning
3054	When darkness falls
3055	Temptations call
3056	And all around me seems undone
3057	You hear my pleas
3058	Supply my needs
3059	And tell me of Your wondrous love
3060	You are the joy in my morning
3061	You're my song of praise
3062	Just like the new day dawning
3063	Flooding my world with grace
3064	Though trials come
3065	And every one
3066	Can take me further from Your truth
3067	You calm my fears
3068	Dry all my tears
3069	And draw me closer, Lord, to You
3070	In You there's no shadow of turning
3071	Constant in all Your ways
3072	You're growing my faith
3073	And I'm learning to lean
3074	On You all of my days
3075	Our Hope Is Alive
3076	Hope that is seen is no hope at all
3077	Our hope is in what is to come
3078	Christ coming again to bring us to heav'n
3079	A glorious end to our fall
3080	The trials we face will fade
3081	When all our tears are washed away
3082	Rejoice!
3083	Our hope is alive
3084	Alive in Him, the Son is risen
3085	Rejoice!
3086	One day we'll arise
3087	From death to life, our hope is alive in Christ
3088	Hope isn't found in things we possess
3089	Nor found in the praises of men
3090	Our will to survive won't bring us new life
3091	We look past this world to the next
3092	Coming on the clouds
3093	We'll see the King and all will bow
3094	Rejoice! Our hope is alive in Christ
3095	Rejoice! Our hope is alive in Christ
3096	Rejoice! Our hope is alive
3097	Rejoice! Our hope is alive
3098	Rejoice! Our hope is alive in Christ
3099	Music and words by Neil & Kate DeGraide
3100	Glory Awaits
3101	Blood-bought children who are suff'ring
3102	It won't be long, It won't be long
3103	Storm-tossed pilgrim, if you're struggling
3104	It won't be long, It won't be long
3105	Though your flesh is now decaying
3106	It won't be long, It won't be long
3107	A new body God is making
3108	It won't be long, It won't be long
3109	Glory awaits
3110	For all God's redeemed
3111	Glory awaits
3112	And we'll be free
3113	All you saints now bound in prison
3114	It won't be long, It won't be long
3115	Here's your freedom: Christ is risen
3116	It won't be long, It won't be long
3117	Glory awaits
3118	For all God's redeemed
3119	Glory awaits
3120	And we'll be free
3121	We are longing for Christ's appearing
3122	It won't be long, It won't be long
3123	Tears will vanish when we see Him
3124	It won't be long, It won't be long
3125	Glory awaits
3126	For all God's redeemed
3127	Glory awaits
3128	And we'll be free
3129	Nothing in All the Earth
3130	What shall separate us from Your love?
3131	Can years of sorrow break eternal bonds?
3132	Can condemnation ever raise its voice
3133	Against the pardon of the blood of Christ?
3134	Though our journey here is long
3135	This will be our triumph song
3136	Nothing in all the earth
3137	Not any height above
3138	Could ever tear us from Your everlasting love
3139	Nothing in all the earth
3140	Not any height above
3141	Could ever tear us from Your everlasting love
3142	What shall separate us from Your love?
3143	For now the sting of death is overcome
3144	And all the powers of this world must fall
3145	Before Your feet because You rule them all
3146	And though our journey here is long
3147	This shall be our triumph song
3148	Nothing in all the earth
3149	Not any height above
3150	Could ever tear us from Your everlasting love
3151	Nothing in all the earth
3152	Not any height above
3153	Could ever tear us from Your everlasting love
3154	Nothing in all the earth
3155	Could ever tear us from
3156	Your everlasting love
3157	O Holy Night (Hear the Gospel Story)
3158	O holy night, the stars are brightly shining,
3159	It is the night of our dear Savior's birth.
3160	Long lay the world in sin and error pining,
3161	Till He appeared and the soul felt its worth.
3162	A thrill of hope, the weary world rejoices,
3163	For yonder breaks a new and glorious morn.
3164	Fall on your knees, O hear the angel voices!
3165	O night divine, O night when Christ was born!
3166	Humbly He lay, Creator come as creature,
3167	Born on the floor of a hay-scattered stall.
3168	True Son of God, yet bearing human feature,
3169	He entered earth to reverse Adam's fall.
3170	In towering grace, He laid aside His glory,
3171	And in our place, was sacrificed for sin.
3172	Fall on your knees! O hear the gospel story!
3173	O night divine, O night when Christ was born!
3174	Come then to Him Who lies within the manger,
3175	With joyful shepherds, proclaim Him as Lord.
3176	Let not the Promised Son remain a stranger;
3177	In reverent worship, make Christ your Adored.
3178	Eternal life is theirs who would receive Him;
3179	With grace and peace, their lives He will adorn.
3180	Fall on your knees! Receive the Gift of heaven!
3181	O night divine, O night when Christ was born
3182	O night, O holy night when Christ was born
3183	Who Would Have Dreamed
3184	On a starlit hillside, shepherds watched their sheep
3185	Slowly, David's city drifted off to sleep
3186	But to this little town of no great renown
3187	The Lord had a promise to keep
3188	Prophets had foretold it, a mighty King would come
3189	Long-awaited Ruler, God's anointed one
3190	But the Sovereign of all looked helpless and small
3191	As God gave the world His own Son
3192	And who would have dreamed or ever foreseen
3193	That we could hold God in our hands?
3194	The Giver of Life is born in the night
3195	Revealing God's glorious plan
3196	To save the world
3197	Wondrous gift of heaven: the Father sends the Son
3198	Planned from time eternal, moved by holy love
3199	He will carry our curse and death He'll reverse
3200	So we can be daughters and sons
3201	Before the Skies
3202	Before the skies were stretched abroad
3203	From everlasting was the Word
3204	God was He; the Word was God
3205	And He must be adored
3206	By the Word all came to be
3207	The universe and all contained
3208	Showing God's authority
3209	His power and His reign
3210	Glory, glory
3211	Glory in the highest
3212	Glory, glory
3213	Glory God is with us
3214	With us
3215	Though His glories still proceed
3216	Never changing from our Lord
3217	He laid down His majesty
3218	And took on human form
3219	Mortals here beheld His face
3220	The Heav'nly Father's perfect Son
3221	Full of truth and full of grace
3222	The Savior now has come!
3223	He gave up His life in love
3224	So our lips could gladly tell
3225	Christ, the Word, has come to us
3226	Our Lord, Immanuel
3227	One Still Night
3228	One still night, Mary awoke
3229	Stirred by an angel, she trembled as he spoke
3230	One small child would soon be born
3231	The King of kings will wear a crown of thorns
3232	Glory to God, the angels sang
3233	"Immanuel was born for you this day
Peace on earth, good will toward men
Immanuel has come to Bethlehem
Immanuel has come to Bethlehem"
3234	One still night, while Joseph dreamed
3235	He saw a vision within his troubled sleep
3236	One small child, his bride would give
3237	Deliverer delivered to save us from our sin
3238	And to His kingdom there'll be no end
3239	And to His kingdom there'll be no end
3240	And to His kingdom there'll be no end
3241	One still night, a light was shown
3242	That all the darkness could never overcome
3243	O Come, O Come, Emmanuel
3244	O come, O come, Emmanuel
3245	And ransom captive Israel
3246	That mourns in lonely exile here
3247	Until the Son of God appear
3248	O come, Thou, Dayspring from on high
3249	And cause Thy light on us to rise
3250	Disperse the gloomy clouds of night
3251	And death's dark shadow put to flight
3252	Rejoice! Rejoice! Emmanuel
3253	Shall come to thee, O Israel
3254	O come, O come, true prophet of the Lord
3255	And turn the key to heaven's door
3256	Be Thou our comforter and guide
3257	And lead us to the Father's side
3258	Rejoice! Rejoice! Emmanuel
3259	Shall by His word our darkness dispel
3260	O come, our great High Priest, and intercede
3261	Thy sacrifice, our only plea
3262	The judgment we no longer fear
3263	Thy precious blood has brought us near
3264	Rejoice! Rejoice! Emmanuel
3265	Has banished every fear of hell
3266	O Come, Thou King of nations bring
3267	An end to all our suffering
3268	Bid every pain and sorrow cease
3269	And reign now as our Prince of Peace
3270	Rejoice! Rejoice! Emmanuel
3271	Rejoice! Rejoice! Emmanuel
3272	Rejoice! Rejoice! Emmanuel
3273	Shall come again with us to dwell
3274	God Made Low
3275	Prophets promised long ago
3276	A King would come to bring us hope
3277	And now a virgin bears a son
3278	The time to save the world has come
3279	Humble shepherds run in haste
3280	To see the One the angels praised
3281	In cattle stall they find a girl
3282	Who holds the hope of all the world
3283	Emmanuel has come to us
3284	The Christ is born, Hallelujah!
3285	Our God made low to raise us up
3286	Emmanuel, has come to us
3287	As He sleeps upon the hay
3288	He holds the moon and stars in place
3289	Though born an infant He remains
3290	The sovereign God of endless days
3291	For all our sins one day He'll die
3292	To make us sons of God on high
3293	Let every heart prepare Him room
3294	The promises have all come true
3295	What Child Is This
3296	What Child is this Who, laid to rest
3297	On Mary's lap is sleeping?
3298	Whom angels greet with anthems sweet
3299	While shepherds watch are keeping?
3300	This, this is Christ the King
3301	Whom shepherds guard and angels sing
3302	Haste, haste, to bring Him laud
3303	The Babe, the Son of Mary
3304	Why lies He in such mean estate
3305	Where ox and lamb are feeding?
3306	Good Christian, fear, for sinners here
3307	The silent Word is pleading
3308	Nails, spear shall pierce Him through
3309	The cross be borne for me, for you
3310	Hail, hail the Word made flesh
3311	The Babe, the Son of Mary
3312	So bring Him incense, gold and myrrh
3313	Come peasant, king to own Him
3314	The King of kings salvation brings
3315	Let loving hearts enthrone Him
3316	Raise, raise a song on high
3317	The virgin sings her lullaby
3318	Joy, joy for Christ is born
3319	The Babe, the Son of Mary
3320	He Who Is Mighty
3321	Oh, the mercy our God has shown
3322	To those who sit in death's shadow
3323	The sun on high pierced the night
3324	Born was the Cornerstone
3325	Unto us a Son is given, unto us a Child is born
3326	He Who is mighty has done a great thing
3327	Taken on flesh, conquered death's sting
3328	Shattered the darkness and lifted our shame
3329	Holy is His name
3330	Oh, the freedom our Savior won
3331	The yoke of sin has been broken
3332	Once a slave, now by grace
3333	No more condemnation
3334	Unto us a Son is given, unto us a Child is born
3335	He Who is mighty has done a great thing
3336	Taken on flesh, conquered death's sting
3337	Shattered the darkness and lifted our shame
3338	Holy is His name
3339	Holy is His name
3340	Now my soul magnifies the Lord
3341	I rejoice in the God Who saves
3342	I will trust His unfailing love
3343	I will sing His praises all my days
3344	Now my soul magnifies the Lord
3345	I rejoice in the God Who saves
3346	I will trust His unfailing love
3347	I will sing His praises all my days
3348	He Who is mighty has done a great thing
3349	Taken on flesh, conquered death's sting
3350	Shattered the darkness and lifted our shame
3351	Holy is His name
3352	Holy is His name
3353	Come All Ye Faithful
3354	Come all ye faithful
3355	Joyful and triumphant
3356	Oh Come ye, oh come ye, to Bethlehem
3357	Come and behold Him
3358	Born the king of angels
3359	Oh come let us adore Him
3360	Oh come let us adore Him
3361	Oh come let us
3362	Adore Him
3363	Christ, the Lord
3364	Yea Lord we greet Thee
3365	Born this happy morning
3366	Jesus to Thee be all glory given
3367	Word of the Father
3368	Now in flesh appearing
3369	Oh come let us adore Him
3370	Oh come let us adore Him
3371	Oh come let us
3372	Adore Him
3373	Christ, the Lord
3374	True God oh true God
3375	Life from light eternal
3376	Humbly he enters the virgin's womb
3377	Son of the Father,
3378	Begotten, not created
3379	Oh come let us adore Him
3380	Oh come let us adore Him
3381	Oh come let us
3382	Adore Him
3383	Christ, the Lord
3384	It Is Not Death To Die (Split Trax)
3385	It is not death to die
3386	To leave this weary road
3387	And join the saints who dwell on high
3388	Who've found their home with God
3389	It is not death to close
3390	The eyes long dimmed by tears
3391	And wake in joy before Your throne
3392	Delivered from our fears
3393	O Jesus, conquering the grave
3394	Your precious blood has power to save
3395	Those who trust in You
3396	Will in Your mercy find
3397	That it is not death to die
3398	It is not death to fling
3399	Aside this earthly dust
3400	And rise with strong and noble wing
3401	To live among the just
3402	It is not death to hear
3403	The key unlock the door
3404	That sets us free from mortal years
3405	To praise You evermore
3406	Hide Away In the Love of Jesus (Split Trax)
3407	Come, weary saints, though tired and weak
3408	Hide away in the love of Jesus
3409	Your strength will return by His quiet streams
3410	Hide away in the love of Jesus
3411	Come, wandering souls, and find your home
3412	Hide away in the love of Jesus
3413	He offers the rest that you yearn to know
3414	Hide away in the love of Jesus
3415	Hear Him calling your name
3416	See the depths of His love
3417	In the wounds of His grace
3418	Hide away
3419	Come, guilty ones weighed down with sin
3420	Hide away in the love of Jesus
3421	The freedom you long for is found in Him
3422	Hide away in the love of Jesus
3423	Come, hopeless hearts, do not despair
3424	Hide away in the love of Jesus
3425	For ten thousand joys await you there
3426	Hide away in the love of Jesus
3427	My Life Is an Offering
3428	This life is an altar
3429	Where I want to offer
3430	My soul, and my mind, and strength
3431	Cleansed by Your mercy to live a life worthy
3432	Of the One Who called my name
3433	Jesus, be glorified
3434	Jesus, be magnified
3435	Let me be a pleasing sacrifice
3436	Jesus, be glorified
3437	Jesus, be magnified
3438	Here on the altar
3439	My life is an offering
3440	How could I not love You?
3441	You authored my rescue
3442	Raised me up from death to life
3443	Your Spirit is in me, revealing Your glory
3444	Oh what joy as I give my life
3445	Jesus, be glorified
3446	Jesus, be magnified
3447	Let me be a pleasing sacrifice
3448	Jesus, be glorified
3449	Jesus, be magnified
3450	Here on the altar
3451	My life is an offering
3452	I choose to lose my life, Lord And find it in You Jesus, be glorified
3453	Jesus, be magnified
3454	Let me be a pleasing sacrifice
3455	Jesus, be glorified
3456	Jesus, be magnified
3457	Here on the altar
3458	My life is an offering
3459	It's Your Grace
3460	You will save whom You will save
3461	We're the lost and helpless ones
3462	The rebels and the renegades
3463	Who spurned Your holy love
3464	You will save whom You will save
3465	Mercy will be magnified
3466	Everyone has gone astray
3467	And followed after lies
3468	But You have loved us and opened our eyes
3469	It's Your grace
3470	From beginning to the end
3471	It's Your grace
3472	We will never comprehend
3473	Why You drew the ones who ran from You
3474	What can we do but offer You praise?
3475	You will save whom You will save
3476	We were captive to our wills
3477	And if our hearts had not been changed
3478	We'd flee Your mercy still
3479	You will save whom You will save
3480	Who can question what You do?
3481	You're the potter, we're the clay
3482	You can make us as You choose
3483	And there is no one who boasts before You
3484	You will save whom You will save
3485	Yet the promised hope remains
3486	You will rescue anyone
3487	Who calls upon Your name
3488	You will save whom You will save
3489	Faithful love won't be denied
3490	Christ has overcome the grave
3491	And for our sins He died
3492	And when He comes back His glory will shine
3493	All Glory Be Forever
3494	We had turned from God to sin's disgrace
3495	We chose the path to hell
3496	Perfect law of God condemned our race
3497	For all in Adam fell
3498	But the righteousness of God appeared
3499	And the world found hope again
3500	For the Righteous One has come down to bear
3501	All the curse of sin and death
3502	Now to Him Who's seated on the throne
3503	All glory be forever
3504	Oh, the depths of wisdom, grace, and power
3505	All glory be forever
3506	All glory be forever
3507	Every bond of sin that held us fast
3508	Is left in Jesus' grave
3509	We've been freed from all that gripped our past
3510	From Satan's rule and reign
3511	We've been raised to life to breathe again
3512	As captives now reclaimed
3513	All our guilt is gone, all our striving ceased
3514	We're alive to seek His fame
3515	Now to Him Who's seated on the throne
3516	All glory be forever
3517	Oh, the depths of wisdom, grace, and power
3518	All glory be forever
3519	All glory be forever
3520	Now our future's fixed, our journey clear
3521	God will not let us go
3522	Every trial that tempts our hearts to fear
3523	He'll use to give us hope
3524	All creation groans as we await
3525	What our eyes have longed to see
3526	Every pain and evil we've long endured
3527	Will be crushed by Christ our King
3528	Now to Him Who's seated on the throne
3529	All glory be forever
3530	Oh, the depths of wisdom, grace, and power
3531	All glory be forever
3532	All glory be forever
3533	Through the Precious Blood
3534	You have ordained every breath we take
3535	In pleasure or pain, there is no mistake
3536	Gladness and grief, both are in Your hand
3537	And sufferings brief carry out Your plan
3538	And our fleeting sorrows
3539	Will yield an endless prize
3540	When some bright tomorrow
3541	We'll see You with our eyes, and
3542	Grace upon grace flows down, flows down
3543	Grace upon grace flows down, flows down
3544	Through the precious blood of Christ
3545	Father of lights, Giver of all grace
3546	Your mercies crown our lives all our days
3547	River of Life, quench our thirsty souls
3548	For no true delight does Your love withhold
3549	And in every season
3550	We are satisfied
3551	For just one reason
3552	Christ was crucified, and
3553	Grace upon grace flows down, flows down
3554	Grace upon grace flows down, flows down
3555	Through the precious blood of Christ
3556	All good gifts, every good thing
3557	Comes to us freely, so freely
3558	All good gifts, every good thing
3559	Comes to us freely, so freely
3560	Through the precious blood
3561	Through the precious blood
3562	Grace upon grace flows down, flows down
3563	Grace upon grace flows down, flows down
3564	Through the precious blood of Christ
3565	Totally God, Totally Man
3566	Jesus, He's fully God and fully man
3567	That's really hard to understand
3568	So, let me try to explain
3569	Jesus, His Word upholds the galaxies
3570	But He babbled like a baby
3571	In His mother's arms
3572	Jesus understands the universe
3573	But He had to go to school to learn
3574	How to write His name
3575	Jesus walked upon the ocean blue
3576	But His feet got tired and dirty too
3577	On the dusty roads
3578	Jesus cried when His friend Lazarus died
3579	But His power brought Him back to life
3580	When He called his name
3581	He's totally God (totally God) and totally man (totally man)
3582	Both in One (both in One), He's the great I AM (the great I AM)
3583	To save the world (to save the world), fulfill God's plan (fulfill God's plan)
3584	He had to be totally God, totally man
3585	Jesus obeyed His Father perfectly
3586	And we know that's something you and me
3587	Couldn't ever do
3588	No, no, no
3589	Jesus died to pay for all our sins
3590	Rose to save the ones who trust in Him
3591	For eternity
3592	He's totally God (totally God) and totally man (totally man)
3593	Both in One (both in One), He's the great I AM (the great I AM)
3594	To save the world (to save the world), fulfill God's plan (fulfill God's plan)
3595	He had to be totally God, totally man
3596	He's totally God (totally God), totally man (totally man)
3597	Both in One (both in One), He's the great I AM (the great I AM)
3598	To save the world (to save the world), fulfill God's plan (fulfill God's plan)
3599	He had to be totally God, totally man
3600	Totally God, totally man
3601	The Gospel Song - Live
3602	Holy God in love became
3603	Perfect man to bear my blame
3604	On the cross he took my sin
3605	By his death I live again
3606	Holy God in love became
3607	Perfect man to bear my blame
3608	On the cross he took my sin
3609	By his death I live again
3610	Holy, Holy, Holy - Live
3611	Holy, holy, holy! Lord God Almighty!
3612	Early in the morning our song shall rise to Thee;
3613	Holy, holy, holy, merciful and mighty!
3614	God in three Persons, blessed Trinity!
3615	Holy, holy, holy! All the saints adore Thee,
3616	Casting down their golden crowns around the glassy sea,
3617	Cherubim and seraphim falling down before Thee,
3618	Who wert and art, and evermore shalt be.
3619	Holy, holy, holy! Though the darkness hide Thee,
3620	Though the eye of sinful man Thy glory may not see;
3621	Only Thou art holy; there is none beside Thee,
3622	Perfect in power, love, and purity.
3623	Holy, holy, holy! Lord God Almighty!
3624	All Thy works shall praise Thy name in earth and sky and sea;
3625	Holy, holy, holy, merciful and mighty!
3626	God in three Persons, blessed Trinity!
3627	Behold Our God - Live
3628	Who has held the oceans in His hands
3629	Who has numbered every grain of sand
3630	Kings and nations tremble at His voice
3631	All creation rises to rejoice
3632	Behold our God seated on His throne
3633	Come let us adore Him
3634	Behold our King nothing can compare
3635	Come let us adore Him!
3636	Who has given counsel to the Lord
3637	Who can question any of His Words
3638	Who can teach the One who knows all things
3639	Who can fathom all His wondrous deeds
3640	Who has felt the nails upon His hands
3641	Bearing all the guilt of sinful man
3642	God eternal humbled to the grave
3643	Jesus, Savior risen now to reign!
3644	Men: You will reign forever!
3645	Women: Let Your glory fill the earth
3646	Speak, O Lord - Live
3647	Speak, O Lord, as we come to You
3648	To receive the food of Your Holy Word.
3649	Take Your truth, plant it deep in us;
3650	Shape and fashion us in Your likeness,
3651	That the light of Christ might be seen today
3652	In our acts of love and our deeds of faith.
3653	Speak, O Lord, and fulfill in us
3654	All Your purposes for Your glory.
3655	Teach us, Lord, full obedience,
3656	Holy reverence, true humility;
3657	Test our thoughts and our attitudes
3658	In the radiance of Your purity.
3659	Cause our faith to rise; cause our eyes to see
3660	Your majestic love and authority.
3661	Words of pow'r that can never fail—
3662	Let their truth prevail over unbelief.
3663	Speak, O Lord, and renew our minds;
3664	Help us grasp the heights of Your plans for us—
3665	Truths unchanged from the dawn of time
3666	That will echo down through eternity.
3667	And by grace we'll stand on Your promises,
3668	And by faith we'll walk as You walk with us.
3669	Speak, O Lord, till Your church is built
3670	And the earth is filled with Your glory.
3671	I Greet Thee, Who My Sure Redeemer Art - Live
3672	I greet Thee, who my sure Redeemer art,
3673	My only Trust and Savior of my heart,
3674	Who pain didst undergo for my poor sake;
3675	I pray Thee, from our hearts all cares to take.
3676	Thou art the King of mercy and of grace,
3677	Reigning omnipotent in every place;
3678	So come, O King, and our whole being sway;
3679	Shine on us with the light of Thy pure day.
3680	Thou art the life by which alone we live
3681	And all our substance and our strength receive;
3682	Sustain us by Thy faith and by Thy pow'r,
3683	And give us strength in ev'ry trying hour.
3684	Our hope is in no other save in Thee;
3685	Our faith is built upon Thy promise free;
3686	Lord, give us peace and make us calm and sure,
