	Sentence
0	As Long as You Are Glorified
1	Shall I take from Your hand Your blessings
2	Yet not welcome any pain
3	Shall I thank You for days of sunshine
4	Yet grumble in days of rain
5	Shall I love You in times of plenty
6	Then leave You in days of drought
7	Shall I trust when I reap a harvest
8	But when winter winds blow, then doubt
9	Oh let Your will be done in me
10	In Your love I will abide
11	Oh I long for nothing else as long
12	As You are glorified
13	Are You good only when I prosper
14	And true only when I'm filled
15	Are You King only when I'm carefree
16	And God only when I'm well
17	You are good when I'm poor and needy
18	You are true when I'm parched and dry
19	You still reign in the deepest valley
20	You're still God in the darkest night
21	So quiet my restless heart
22	Quiet my restless heart
23	Quiet my restless heart in you
24	Oh let Your will be done in me
25	In Your love I will abide
26	Oh I long for nothing else as long
27	As You are glorified
28	O Great God
29	O great God of highest heaven
30	Occupy my lowly heart
31	Own it all and reign supreme
32	Conquer every rebel power
33	Let no vice or sin remain
34	That resists Your holy war
35	You have loved and purchased me
36	Make me Yours forevermore
37	I was blinded by my sin
38	Had no ears to hear Your voice
39	Did not know Your love within
40	Had no taste for heaven's joys
41	Then Your Spirit gave me life
42	Opened up Your Word to me
43	Through the gospel of Your Son
44	Gave me endless hope and peace
45	Help me now to live a life
46	That's dependent on Your grace
47	Keep my heart and guard my soul
48	From the evils that I face
49	You are worthy to be praised
50	With my every thought and deed
51	O great God of highest heaven
52	Glorify Your Name through me
53	You are worthy to be praised
54	With my every thought and deed
55	O great God of highest heaven
56	Glorify Your Name through me
57	Let Your Kingdom Come
58	Your glorious cause, O God
59	Engages our hearts
60	May Jesus Christ be known
61	Wherever we are
62	We ask not for ourselves, but for Your renown
63	The cross has saved us so we pray
64	Your kingdom come
65	Let Your kingdom come
66	Let Your will be done
67	So that everyone might know Your Name
68	Let Your song be heard everywhere on earth
69	Till Your sovereign work on earth is done
70	Let Your kingdom come
71	Give us Your strength, O God
72	And courage to speak
73	Perform Your wondrous deeds
74	Through those who are weak
75	Lord use us as You want, whatever the test
76	By grace we'll preach Your gospel
77	Till our dying breath
78	Let Your kingdom come
79	Let Your will be done
80	So that everyone might know Your Name
81	Let Your song be heard everywhere on earth
82	Till Your sovereign work on earth is done
83	Let Your kingdom come
84	Let Your kingdom come
85	Let Your will be done
86	So that everyone might know Your Name
87	Let Your song be heard everywhere on earth
88	Till Your sovereign work on earth is done
89	Let Your kingdom come
90	I Come Running
91	Jesus I am blind be my light
92	Darkened in my mind be my wisdom
93	Bend my stubborn will to Your own
94	Open up my ears to hear Your Spirit
95	Melt my conscience once again
96	Help me hate the slightest sin
97	And when Satan comes to tempt me
98	I come running to You when I fear when I'm tried
99	I come running to You to Your blood to Your side
100	And there my soul finds rest
101	There my soul finds rest in You
102	Shepherd of my soul lead me on
103	To the pastures green in Your scriptures
104	Make me to lie down by waters still
105	Fill me with Your peace in the tempest
106	I take my refuge in Your cross
107	By Your sacrifice I'm washed
108	And when Satan comes accusing
109	I come running to You when I fear when I'm tried
110	I come running to You to Your blood to Your side
111	And there my soul finds rest
112	There my soul finds rest in You
113	Once I was Your foe a slave to sin
114	A stranger to Your love a hopeless outcast
115	But You have brought me near
116	I'm bought with blood
117	Now I'm Your precious child an heir with Jesus
118	You pour heav'n into my soul
119	Your wondrous love it overflows
120	And I marvel how You love me
121	I come running to You when I fear when I'm tried
122	I come running to You to Your blood to Your side
123	And there my soul finds rest
124	There my soul finds rest in You
125	My soul finds rest
126	My sould finds rest in You
127	When I'm burned,
128	When I'm tired,
129	When I'm cold, lost my fire
130	When I'm weary in this race
131	I will run and seek Your face
132	How Deep
133	You were broken that I might be healed
134	You were cast off that I might draw near
135	You were thirsty that I might come drink
136	Cried out in anguish that I might sing
137	How deep is Your love
138	How high and how wide is Your mercy
139	How deep is Your grace
140	Our hearts overflow with praise
141	To You
142	You knew darkness that I might know light
143	Wept great tears that mine might be dried
144	Stripped of glory that I might be clothed
145	Crushed by Your Father to call me Your own
146	Heavenly Father, Beautiful Son
147	Father, You loved me
148	Sent Your Son to redeem
149	Jesus, You washed me
150	By Your blood I am clean
151	Spirit, You've opened these blinded eyes
152	And brought me to Christ
153	Heavenly Father, beautiful Son
154	Spirit of light and truth
155	Thank You for bringing sinners to come to You
156	Father, You gave me
157	To Jesus to keep
158	And Jesus, You love me
159	As a shepherd, his sheep
160	Spirit, You've given me faith in the Son
161	And made our hearts one
162	Father, You're waiting
163	To hear my requests
164	Jesus, Your loving
165	Open hand is outstretched
166	Spirit, You're in me, You intercede
167	And help in my need
168	All That I Need
169	In You is strength to sustain me
170	And wisdom enough to guide my hand
171	Mercy enough to forgive me
172	And power to finish what You began
173	All that I need is in You, Jesus
174	The fountain of grace that overflows
175	All that I need is in You, Jesus
176	You are my only hope
177	You are my only hope
178	In You is fullness of gladness
179	And fullness of grace for every need
180	Rest for the ones who are weary
181	And beauty surpassing all that we've seen
182	All that I need is in You, Jesus
183	The fountain of grace that overflows
184	All that I need is in You, Jesus
185	You are my only hope
186	You are my only hope
187	You satisfy my heart
188	You satisfy my soul
189	You satisfy my heart
190	O help me always know
191	You satisfy my heart
192	You satisfy my soul
193	You satisfy my heart
194	O help me always know
195	All that I need, Jesus
196	All that I need
197	All that I need... is found in You
198	All that I need is in You, Jesus
199	The fountain of grace that overflows
200	All that I need is in You, Jesus
201	You are my only hope
202	You are my only hope
203	You are my only hope
204	In the Valley
205	When You lead me to the valley of vision
206	I can see You in the heights
207	And though my humbling
208	Wouldn't be my decision
209	It's here Your glory shines so bright
210	So let me learn that the cross
211	Precedes the crown
212	To be low is to be high
213	That the valley's where You make me
214	More like Christ
215	Let me find Your grace in the valley
216	Let me find Your life in my death
217	Let me find Your joy in my sorrow
218	Your wealth in my need
219	That You're near with every breath
220	In the valley
221	In the daytime there are stars in the heavens
222	But they only shine at night
223	And the deeper that I go into darkness
224	The more I see their radiant light
225	So let me learn that my losses are my gain
226	To be broken is to heal
227	That the valley's where Your power is revealed
228	Let me find Your grace in the valley
229	Let me find Your life in my death
230	Let me find Your joy in my sorrow
231	Your wealth in my need
232	That You're near with every breath
233	In the valley
234	Let me find Your joy in my sorrow
235	Your wealth in my need
236	That You're near with every breath
237	In the valley
238	You're near to me
239	The Son of God Came Down
240	the son of god came down
241	and laid aside his crown
242	born with out great
243	renown, this
244	sovereign one
245	All holiness and might
246	All glory shining bright
247	have came to earth
248	this night in mary's night
249	We Will Seek You
250	Wise men saw a starry sign
251	And left their homes behind for You
252	We too have seen the Morning Star
253	And hope has filled our hearts anew
254	So like the wise men we will come
255	And we will seek You
256	We will seek You
257	We will seek You
258	Who sought us out to make us new
259	We will seek You
260	Wise men traveled long and far
261	Following the star of God
262	But You've come closer than the air
263	You brought us near by Your own blood
264	So like the wise men we will come
265	And we will seek You
266	We will seek You
267	We will seek You
268	Who sought us out to make us new
269	We will seek You
270	Wise men came with gifts of gold
271	Frankincense and myrrh for You
272	We'll bring hearts aflame with love
273	Gratefulness and praise to You
274	So like the wise men we will come
275	And we will seek You
276	We will seek You
277	We will seek You
278	Who sought us out to make us new
279	Who sought us out to make us new
280	We will seek You
281	Rejoice
282	We do not have the lyrics for Rejoice yet.
283	Glory Be to God
284	Glory be to God on high
285	Let peace on earth descend
286	God comes down before our eyes
287	To Bethlehem
288	God invisible appears
289	Endless ages wrapped in years
290	He has come who cannot change
291	And Jesus is His name
292	Emptied of His majesty
293	He comes in human form
294	Being’s source begins to be
295	And God is born
296	All our griefs He’ll gladly share
297	All our sins He’ll fully bear
298	He will cover our disgrace
299	And suffer in our place
300	Let the joyful news ring out
301	The Prince of Peace proclaim
302	Lift your heart and voice to shout
303	Immanuel’s name
304	God has kept His promises
305	What a work of grace this is
306	Son of Mary, chosen One
307	The Lamb of God has come
308	Hosanna, hosanna
309	The Lamb of God has come
310	Hosanna, hosanna
311	He is the promised One
312	Glory be to God on high
313	Let peace on earth descend
314	God comes down before our eyes
315	To Bethlehem
316	Emmanuel, Emmanuel
317	We have come today to worship
318	We have come to praise the One
319	Who came down into our darkness
320	Born a lowly virgin's son
321	You who did not come with splendor
322	Pomp and strength and majesty
323	You who came to us in weakness
324	Born to us in poverty
325	Emmanuel, Emmanuel, Emmanuel
326	In You alone we hope and trust
327	Jesus, Savior, God with us
328	Emmanuel
329	We were blind and lost and godless
330	Wandering a trackless waste
331	Then hope arose, a glorious beacon
332	Like the star the wise men chased
333	Down from heaven came a Savior
334	Born a child, so small and frail
335	Taking up our pain and troubles
336	Conquering where we had failed
337	You who with a word created
338	Sun and moon and seas and sand
339	Lay there sleeping in a manger
340	Cradled by Your mother's hand
341	You who made the mighty forests
342	Would lie down upon a tree
343	Fastened there with nails for sinners
344	Would bleed and die to set us free
345	Hope Has Come
346	How my happy heart rejoices
347	I can hear the angel voices
348	Christ is born they all are singing
349	From the sky this good news bringing
350	Let the earth rejoice
351	O come and lift your voices
352	Christ the Lord is born today
353	He came from heaven's throne
354	God is born a man today
355	To bring His children home
356	To bring His children home
357	Death and darkness surely tremble
358	Light has come to all the people
359	The Lion comes to crush the serpent
360	He comes a Lamb, a lowly servant
361	Let the earth rejoice
362	O come and lift your voices
363	Christ the Lord is born today
364	He came from heaven's throne
365	God is born a man today
366	To bring His children home
367	To bring His children home
368	God has sent His greatest treasure
369	Shown His love in greatest measure
370	Sending Christ to bleed and suffer
371	Purchasing our joy forever
372	Let the earth rejoice
373	O come and lift your voices
374	Christ the Lord is born today
375	He came from heaven's throne
376	God is born a man today
377	To bring His children home
378	To bring His children home
379	Christ the Lord is born today
380	He came from heaven's throne
381	God is born a man today
382	To bring His children home
383	To bring His children home
384	In My Heart
385	In my heart there is a stirring
386	One that did not start with me
387	A love to worship my Creator
388	To show His love for all to see
389	I will worship
390	I will honor
391	I will exalt the Lord above
392	All my days
393	I'll sing the praises
394	Of His great redeeming love
395	In my heart there is a treason
396	One that poisons all my love
397	Take my heart and consecrate it
398	Wash it in Your cleansing blood
399	Tie me to the Rock unchanging
400	Tie me to His wondrous Cross
401	I'll fix my eyes upon the Savior
402	All other things I count as loss
403	Only Jesus
404	Father of grace, You've sacrificed
405	Your only Son for us, the crucified Jesus
406	Enlarge our hearts to love Your Son
407	O grant to us the grace to walk with Him always
408	To make Him our great delight
409	Bringing worship with our lives
410	Only Jesus! Only Jesus!
411	Give us Jesus, we cry
412	Only Jesus! Only Jesus!
413	The Pearl of greatest price
414	Spirit of grace, You've shed Your light
415	Upon our darkened eyes, unveiling Jesus Christ
416	Come change our hearts, conform our ways
417	To honor Jesus' Name, His glory our ain
418	Let His love compel our own
419	As we worship at His throne
420	Only Jesus! Only Jesus!
421	Give us Jesus, we cry
422	Only Jesus! Only Jesus!
423	The Pearl of greatest price
424	Jesus, our great Savior,
425	Lord of heaven, Son of God
426	Jesus, our great Savior,
427	Lord of heaven, Son of God
428	Only Jesus! Only Jesus!
429	Give us Jesus, we cry
430	Only Jesus! Only Jesus!
431	The Pearl of greatest price
432	Only Jesus! Only Jesus!
433	Give us Jesus, we cry
434	Only Jesus! Only Jesus!
435	The Pearl of greatest price
436	End
437	The Precious Blood
438	Before the cross I kneel and see
439	The measure of my sin
440	How You became a curse for me
441	Though You were innocent
442	The magnitude of Your great love
443	Was shown in full degree
444	When righteous blood, the crimson spill
445	Rained down from Calvary
446	Oh, the precious blood
447	That flowed from Mercy's side
448	Washed away my sin
449	When Christ my Savior died
450	Oh, the precious blood
451	Of Christ the crucified
452	It speaks for me before Your throne
453	Where I stand justified
454	And who am I that I should know
455	This treasure of such worth
456	My Savior's pure atoning blood
457	Shed for the wrath I'd earned
458	For sin has stained my every deed
459	My every word and thought
460	What wondrous love that makes me one
461	Your priceless blood has bought
462	A crown of thorns, pierced hands and feet
463	A body bruised, and Mercy's plea
464	It Was Love
465	It was love that brought You from above
466	To walk upon the earth
467	And love that caused Your weariness
468	Your hunger and Your thirst
469	It was love that caused You to be tried
470	And tempted by the foe
471	And love that brought the nails and cross
472	And love that bought my soul
473	How wonderful Your love, the mystery of mysteries
474	Filling up my heart, more glorious than I know
475	How wonderful Your love
476	There's nothing else so sweet to me
477	I'll never be apart from the Lover of my soul
478	From the Lover of my soul
479	Your love is filled with holiness
480	O Spirit, fan this flame
481	Your love will never cease or cool
482	Your love will never change
483	O let me see Your love for me
484	Around me everywhere
485	The shining sun, a gentle rain
486	Remind me of Your care
487	So I will Trust You
488	Almighty Maker, Universe shaper
489	You put the stars into space
490	Yet You descended, You have befriended
491	Those who had hated Your name, just like me
492	King of Glory, I know You love me
493	So I will trust You, yes I will trust You
494	God Almighty, You have saved me
495	So I will trust You, yes I will trust in You
496	Lord over nations, King of Creation
497	Heaven and earth bow to You
498	I am Your child, I've been reconciled
499	With tender affection You drew me to You
500	King of Glory, I know You love me
501	So I will trust You, yes I will trust You
502	God Almighty, You have saved me
503	So I will trust You, yes I will trust in You
504	How could I not trust my King?
505	The One who has formed me and shaped me
506	I will rejoice and will sing
507	For the One who has made me has saved me
508	King of Glory, I know You love me
509	I will trus in You, I will trust in You
510	King of Glory, I know You love me
511	So I will trust You, yes I will trust You
512	God Almighty, You have saved me
513	So I will trust You, yes I will trust in You
514	Hide Away in the Love of Jesus
515	Come, weary saints, though tired and weak
516	Hide away in the love of Jesus
517	Your strength will return by His quiet streams
518	Hide away in the love of Jesus
519	Come, wandering souls, and find your home
520	Hide away in the love of Jesus
521	He offers the rest that you yearn to know
522	Hide away in the love of Jesus
523	Hear Him calling your name
524	See the depths of His love
525	In the wounds of His grace
526	Hide away
527	Come, guilty ones weighed down with sin
528	Hide away in the love of Jesus
529	The freedom you long for is found in Him
530	Hide away in the love of Jesus
531	Come, hopeless hearts, do not despair
532	Hide away in the love of Jesus
533	For ten thousand joys await you there
534	Hide away in the love of Jesus
535	You Never Change
536	Father of lights, giver of gifts
537	There is no shadow in You
538	Author of life, Fountain of grace
539	Each morning Your mercies are new
540	And You never change, and You never lie
541	Age to age You are the same
542	I will trust in You, all Your faithfulness
543	For I know You never change
544	Father of love, source of all good
545	Tower of strength and my shield
546	When You gave Your Son for those who rebelled
547	Your love for the world was revealed
548	Father of peace, help of the weak
549	Though mountains fall into the sea
550	Though tempests may rage, the sun hide its face
551	Your favor will rest upon me
552	Prepared a Place for Me
553	Mystery of mysteries
554	That God would make for me
555	A place within His family, though once His enemy
556	The Judge of every sinner sent Christ to Calvary
557	To prepare a place for me
558	Judgment should be given
559	For this guilt upon my head
560	But the Father of all glory crushed His Son instead
561	Now I've been adopted, for God made this to be
562	You prepared a place for me
563	Blessed be, blessed be
564	My God and Savior, You've shown me favor
565	And prepared a place for me
566	Father, in the moment
567	When Your Son shall split the skies
568	And myriads of angels acclaim Him with their cries
569	By grace I will be able to join the jubilee
570	You prepared a place for me
571	You Made Us Your Own
572	We were ruined in our sin
573	We were guilty and undone
574	When Your love reached down with sovereign hands
575	And beckoned us to come
576	You sought out the wanderers
577	Made the prodigals come home
578	With a lavish feast You welcomed us
579	For You made us Your own
580	You have loved us like You love Your Son
581	We are heirs with Christ, bought by His blood
582	Oh how great the love that we've been shown
583	We're Your children now, You made us Your own
584	We are strangers to the world
585	But no strangers to Your throne
586	We draw near You now with confidence
587	For all our fears are gone
588	And when Christ our King returns
589	We'll meet saints we've never known
590	And forever we will be amazed
591	That You made us Your own
592	Undying Love
593	My ears had heard of You, now I have seen
594	This bitter sweetness in Your agony
595	My heart was far from You, but You drew me near
596	With loving kindness dried every tear
597	And I can see You
598	Bearing all my shame on the cross
599	"I can hear You cry out, ""It is done"""
600	O Jesus, Your sacrifice was more than enough
601	In Your death I see undying love
602	My heart is broken and I'm down on my knees
603	To see my Savior suffering for me
604	But You descended, lifting me up
605	Washing my feet, filling my cup
606	We Sing
607	We've come together in Your name
608	We've come together to proclaim
609	How great You are
610	Once we were going our own ways
611	Now we're a people for Your praise
612	How great You are
613	We sing as sons and daughters
614	Sing to God our Father
615	All because of Jesus
616	We sing, His blood has bought us
617	Sing, Your mercy called us
618	All because of Jesus we sing
619	Jesus, You're powerful to save
620	Jesus, You've risen from the grave
621	How great You are
622	Your blood gave us peace with God
623	Your love has broken down our walls
624	How great You are
625	By grace we have been saved
626	To be Your dwelling place
627	You took our curse and made us one
628	It's nothing we could do
629	Our only boast is You
630	So we rejoice in what You've done
631	You Gave Your Son
632	Father, compassionate and tender
633	Your ears are ever open to my prayers
634	Father, You feed the crying ravens
635	You daily lift the burdens that I bear
636	So I will thank You for Your mercy
637	You gave Your Son
638	Righteous One for the defiled
639	You gave Your Son
640	By His blood we're reconciled
641	To our God
642	Father, You know that I grow weary
643	I need You to draw near me and be my strength
644	Father, I long to know Your presence
645	For You're the joy of heaven and my King
646	So I will thank You for Your mercy
647	Whom have I in heaven but You
648	And none on earth compares with You
649	Precious Children
650	Broken and defiled
651	Clinging to our filth
652	We gloried in our shame
653	Running far from You
654	Still Your mercy sought and saved us
655	Hallelujah
656	We belong to You
657	You have washed our stains
658	And have raised us up with Christ
659	Precious children in Your eyes
660	You gave Your only Son
661	Your joy and Your delight
662	You nailed Him to the cross
663	You crushed Him for our sin
664	How could you love us like You love Him
665	The Greatest of All
666	The greatest of all transactions
667	The costliest purchase price
668	Father, Your Son's atoning death
669	Was given in payment for mine
670	To buy me back from slavery
671	To set me free from my chains
672	Redeemed, how I love to proclaim it
673	Redeemed by the blood of the Lamb
674	Redeemed through Your infinite mercy
675	Your child forever I am
676	Now I'll never know Your judgment
677	You ransomed and saved my soul
678	Jesus, Your death and Yours alone
679	Has canceled the debt that I owed
680	You satisfied the law's demand
681	And new life's been given to me
682	God Delights In You
683	Calling every daughter
684	Calling every son
685	All who've been adopted
686	Through a sacrifice of love
687	There's no need for you to fear
688	Your debts have all been cleared
689	Calling all the downcast
690	Who feel like they're alone
691	Anyone who's longing
692	For a family of their own
693	God's prepared a place for you
694	He's calling you to
695	Come and sing, come and dance
696	The Father's singing over you
697	Come rejoice and be glad
698	For God delights in you, in you
699	Calling all who've wandered
700	Gone off on their own
701	Anyone who wonders
702	If they're welcome back at home
703	The God of grace makes all things new
704	He's calling you to
705	You chose us to be the objects of Your love
706	In spite of all we have done
707	You gave Your beloved Son to die for us
708	To make us daughters and sons
709	Completely Done
710	What reason have I to doubt
711	Why would I dwell in fear
712	When all I have known is grace
713	My future in Christ is clear
714	My sins have been paid in full
715	There's no condemnation here
716	I live in the good of this
717	My Father has brought me near
718	I'm leaving my fears behind me now
719	The old is gone, the new has come
720	What You complete is completely done
721	We're heirs with Christ, the victory won
722	What You complete is completely done
723	I don't know what lies ahead
724	What if I fail again
725	You are my confidence
726	You'll keep me to the end
727	I'm leaving my fears behind me now
728	The old is gone, the new has come
729	What You complete is completely done
730	We're heirs with Christ, the victory won
731	What You complete is completely done
732	The old is gone, the new has come
733	The Prodigal
734	You held out Your arms, I walked away
735	Insolent, I spurned Your face
736	Squandering the gifts You gave to me
737	Holding close forbidden things
738	Destitute, a rebel still, a fool in all my pride
739	The world I once enjoyed is death to me
740	No joy, no hope, no life
741	Where now are the friends that I had bought
742	Gone with every penny lost
743	What hope could there be for such as I
744	Sold out to a world of lies
745	Oh to see Your face again, it seems so distant now
746	Could it be that You would take me back
747	A servant in Your house
748	You held out Your arms, I see them still
749	You never left, You never will
750	Running to embrace me, now I know
751	Your cords of love will always hold
752	Mercy's robe, a ring of grace
753	Such favor undeserved
754	You sing over me and celebrate
755	The rebel now Your child
756	Who Made Me to Know You
757	Who made me to know You, but You
758	When dead in sin You gave me new life
759	Now my heart is filled with love for You, Jesus
760	Father, thank You for Your Spirit's work in me
761	For opening my eyes to the Christ of Calvary
762	Jesus, You gave Your life in exchange for mine
763	Now I will live for You who died, Jesus
764	You placed a crown of grace on my head
765	You covered me in robes of righteousness
766	Forever I will always be Yours, Jesus
767	In You Alone
